fund_name,policy,fund_manager_name
K-ALLGR-UI-A(A),"กองทุนนี้เปลี่ยนชื่อมาจากกองทุนเปิดเค ออลโรดส์ โกรท ห้ามขายผู้ลงทุนรายย่อย เมื่อวันที่ 24 มกราคม 2566 | ลงทุนในกองทุน LO Funds – All Roads Growth, Syst. NAV Hdg, (USD), I Class A (กองทุนหลัก) ที่มีนโยบายลงทุนในตราสารทุน ตราสารหนี้ที่ออกโดยภาครัฐหรือภาคเอกชน และสินค้าโภคภัณฑ์ ในประเทศต่างๆ ทั่วโลก และมีการจัดสรรน้ำหนักการลงทุนในสินทรัพย์ดังกล่าวเพื่อควบคุมความเสี่ยงของพอร์ตการลงทุนโดยรวม | ป้องกันความเสี่ยงด้านอัตราแลกเปลี่ยนตามดุลยพินิจของผู้จัดการกองทุน | อาจทำธุรกรรมการกู้ยืมเงินเพื่อประโยชน์ในการจัดการลงทุนได้ไม่เกิน 50% ของ NAV แต่จะไม่ทำธุรกรรม Repurchase agreement เพื่อประโยชน์ในการจัดการลงทุน และ Short sale | กองทุนนี้ลงทุนในกองทุนหลักซึ่งอาจลงทุนในสัญญาซื้อขายล่วงหน้าที่มีวัตถุประสงค์เพื่อเพิ่มประสิทธิภาพการบริหารการลงทุน และเพื่อเป็นส่วนหนึ่งของกลยุทธ์การลงทุน และกองทุนนี้อาจลงทุนในสัญญาซื้อขายล่วงหน้าเพื่อการเพิ่มประสิทธิภาพการบริหารการลงทุน | บริษัทที่บริหารจัดการกองทุนหลัก คือ Lombard Odier Funds (Europe) S.A. | มุ่งหวังให้ผลประกอบการเคลื่อนไหวตามกองทุนหลัก โดยกองทุนหลักมุ่งหวังให้ผลประกอบการเคลื่อนไหวสูงกว่าดัชนีชี้วัด (active management) และใช้กลยุทธ์ Risk-based methodology เพื่อควบคุมความเสี่ยงของพอร์ตการลงทุนโดยรวม",น.ส. ชุณหวรรณ ขัตตินานนท์
K-ALLGR-UI-C(A),"กองทุนนี้เปลี่ยนชื่อมาจากกองทุนเปิดเค ออลโรดส์ โกรท ห้ามขายผู้ลงทุนรายย่อย เมื่อวันที่ 24 มกราคม 2566 | ลงทุนในกองทุน LO Funds – All Roads Growth, Syst. NAV Hdg, (USD), I Class A (กองทุนหลัก) ที่มีนโยบายลงทุนในตราสารทุน ตราสารหนี้ที่ออกโดยภาครัฐหรือภาคเอกชน และสินค้าโภคภัณฑ์ ในประเทศต่างๆ ทั่วโลก และมีการจัดสรรน้ำหนักการลงทุนในสินทรัพย์ดังกล่าวเพื่อควบคุมความเสี่ยงของพอร์ตการลงทุนโดยรวม | ป้องกันความเสี่ยงด้านอัตราแลกเปลี่ยนตามดุลยพินิจของผู้จัดการกองทุน | อาจทำธุรกรรมการกู้ยืมเงินเพื่อประโยชน์ในการจัดการลงทุนได้ไม่เกิน 50% ของ NAV แต่จะไม่ทำธุรกรรม Repurchase agreement เพื่อประโยชน์ในการจัดการลงทุน และ Short sale | กองทุนนี้ลงทุนในกองทุนหลักซึ่งอาจลงทุนในสัญญาซื้อขายล่วงหน้าที่มีวัตถุประสงค์เพื่อเพิ่มประสิทธิภาพการบริหารการลงทุน และเพื่อเป็นส่วนหนึ่งของกลยุทธ์การลงทุน และกองทุนนี้อาจลงทุนในสัญญาซื้อขายล่วงหน้าเพื่อการเพิ่มประสิทธิภาพการบริหารการลงทุน | บริษัทที่บริหารจัดการกองทุนหลัก คือ Lombard Odier Funds (Europe) S.A. | มุ่งหวังให้ผลประกอบการเคลื่อนไหวตามกองทุนหลัก โดยกองทุนหลักมุ่งหวังให้ผลประกอบการเคลื่อนไหวสูงกว่าดัชนีชี้วัด (active management) และใช้กลยุทธ์ Risk-based methodology เพื่อควบคุมความเสี่ยงของพอร์ตการลงทุนโดยรวม",น.ส. ชุณหวรรณ ขัตตินานนท์
K-GB-A(D),"ลงทุนในกองทุน JPMorgan Funds – Aggregate Bond Fund, Class JPM Aggregate Bond I (acc) - USD (กองทุนหลัก) ที่มุ่งลงทุนในตราสารหนี้ทั่วโลกที่มีอันดับความน่าเชื่อถืออยู่ในอันดับที่สามารถลงทุนได้ (Investment grade) ไม่น้อยกว่า 67% ของทรัพย์สินของกองทุน และอาจลงทุนในสัญญาซื้อขายล่วงหน้า | ป้องกันความเสี่ยงจากอัตราแลกเปลี่ยนไม่น้อยกว่า 75% ของมูลค่าเงินลงทุนต่างประเทศ | บริษัทที่บริหารจัดการกองทุนหลัก คือ JPMorgan Asset Management (Europe) S.à r.l. | กองทุนมุ่งหวังให้ผลประกอบการเคลื่อนไหวตามกองทุนหลัก โดยกองทุนหลักมุ่งหวังให้ผลประกอบการเคลื่อนไหวสูงกว่าดัชนีชี้วัด (active management)",น.ส. ชุณหวรรณ ขัตตินานนท์
K-GB-C(A),"ลงทุนในกองทุน JPMorgan Funds – Aggregate Bond Fund, Class JPM Aggregate Bond I (acc) - USD (กองทุนหลัก) ที่มุ่งลงทุนในตราสารหนี้ทั่วโลกที่มีอันดับความน่าเชื่อถืออยู่ในอันดับที่สามารถลงทุนได้ (Investment grade) ไม่น้อยกว่า 67% ของทรัพย์สินของกองทุน และอาจลงทุนในสัญญาซื้อขายล่วงหน้า | ป้องกันความเสี่ยงจากอัตราแลกเปลี่ยนไม่น้อยกว่า 75% ของมูลค่าเงินลงทุนต่างประเทศ | บริษัทที่บริหารจัดการกองทุนหลัก คือ JPMorgan Asset Management (Europe) S.à r.l. | กองทุนมุ่งหวังให้ผลประกอบการเคลื่อนไหวตามกองทุนหลัก โดยกองทุนหลักมุ่งหวังให้ผลประกอบการเคลื่อนไหวสูงกว่าดัชนีชี้วัด (active management)",น.ส. ชุณหวรรณ ขัตตินานนท์
K-EUROPE-A(D),"ลงทุนในกองทุน Allianz Europe Equity Growth, Class AT-EUR (กองทุนหลัก) ที่มุ่งลงทุนในตราสารแห่งทุนและตราสารเทียบเท่า (Participation Certificate) ของบริษัทที่จดทะเบียนในประเทศสมาชิกสหภาพยุโรปไม่ต่ำกว่า 75% โดยเน้นลงทุนในหุ้นกลุ่มที่คาดว่ามีอัตราการเจริญเติบโตสูง (Growth Stock) | ป้องกันความเสี่ยงจากอัตราแลกเปลี่ยนไม่น้อยกว่า 75% ของมูลค่าเงินลงทุนต่างประเทศ | บริษัทที่บริหารจัดการกองทุนหลัก คือ Allianz Global Investors GmbH | กองทุนมุ่งหวังให้ผลประกอบการเคลื่อนไหวตามกองทุนหลัก โดยกองทุนหลักมุ่งหวังให้ผลประกอบการเคลื่อนไหวสูงกว่าดัชนีชี้วัด (active management)",น.ส. ชุณหวรรณ ขัตตินานนท์
K-FGB6MJ(USD),กองทุนจะเน้นลงทุนในพันธบัตร ตราสารหนี้ที่รัฐบาลต่างประเทศ กระทรวงการคลัง ธนาคารกลาง หรือหน่วยงานของรัฐบาลต่างประเทศเป็นผู้ออก | สำหรับการลงทุนในสกุลเงินอื่นที่ไม่ใช่สกุลเงินดอลลาร์สหรัฐอเมริกา กองทุนจะป้องกันความเสี่ยงด้านอัตราแลกเปลี่ยนทั้งจำนวน (FX Hedging 100%) | กองทุนจะมุ่งเน้นลงทุนเพียงครั้งเดียวโดยถือทรัพย์สินที่ลงทุนไว้จนครบกำหนดอายุของทรัพย์สิน หรือครบอายุของรอบการลงทุนของกองทุนรวม หรือครบอายุของกองทุนรวม (buy-and-hold fund),นาย ชวลิต ปทุมวาสนา
K-ALLRD-UI-A(A),"กองทุนนี้เปลี่ยนชื่อมาจากกองทุนเปิดเค ออลโรดส์ ห้ามขายผู้ลงทุนรายย่อย เมื่อวันที่ 19 มกราคม 2566 | ลงทุนในกองทุน LO Funds – All Roads, Syst. NAV Hdg, (USD), I Class A (กองทุนหลัก) ที่มีนโยบายลงทุนในตราสารทุน ตราสารหนี้ที่ออกโดยภาครัฐหรือภาคเอกชน และสินค้าโภคภัณฑ์ ในประเทศต่างๆ ทั่วโลก และมีการจัดสรรน้ำหนักการลงทุนในสินทรัพย์ดังกล่าวเพื่อควบคุมความเสี่ยงของพอร์ตการลงทุนโดยรวม | ป้องกันความเสี่ยงด้านอัตราแลกเปลี่ยนตามดุลยพินิจของผู้จัดการกองทุน | กองทุนนี้ลงทุนในกองทุนหลักซึ่งอาจลงทุนในสัญญาซื้อขายล่วงหน้าที่มีวัตถุประสงค์เพื่อเพิ่มประสิทธิภาพการบริหารการลงทุน และเพื่อเป็นส่วนหนึ่งของกลยุทธ์การลงทุน และกองทุนนี้อาจลงทุนในสัญญาซื้อขายล่วงหน้าเพื่อการเพิ่มประสิทธิภาพการบริหารการลงทุน หากราคาหลักทรัพย์อ้างอิงมีความผันผวนมาก หรือทิศทางการลงทุนไม่เป็นไปตามที่คาดการณ์ กองทุนอาจขาดทุนได้ อย่างไรก็ตาม ผู้ลงทุนจะขาดทุนไม่เกิน 100% ของมูลค่าเงินลงทุนเริ่มแรกของผู้ลงทุน | บริษัทที่บริหารจัดการกองทุนหลัก คือ Lombard Odier Funds (Europe) S.A. | มุ่งหวังให้ผลประกอบการเคลื่อนไหวตามกองทุนหลัก โดยกองทุนหลักมุ่งหวังให้ผลประกอบการเคลื่อนไหวสูงกว่าดัชนีชี้วัด (active management) และใช้กลยุทธ์ Risk-based methodology เพื่อควบคุมความเสี่ยงของพอร์ตการลงทุนโดยรวม",น.ส. ชุณหวรรณ ขัตตินานนท์
K-MONEY,ลงทุนในเงินฝากและ/หรือตราสารหนี้ภาครัฐและภาคเอกชนที่มีกำหนดวันชำระหนี้ไม่เกิน 397 วันนับแต่วันที่ลงทุน | จะคงอายุตราสารเฉลี่ยแบบถ่วงน้ำหนัก (Portfolio Duration) ของกองทุนไม่เกิน 92 วัน | ลงทุนในต่างประเทศได้ไม่เกิน 30% ของ NAV | ป้องกันความเสี่ยงด้านอัตราแลกเปลี่ยนเต็มจำนวน | มุ่งหวังให้ผลประกอบการเคลื่อนไหวตามดัชนีชี้วัด และในบางโอกาสอาจสร้างผลตอบแทนสูงกว่าดัชนีชี้วัด,น.ส. อัมไพวรรณ เมลืองนนท์
K-MIDSMALL,"ลงทุนในหุ้นไทยของบริษัทขนาดกลางและขนาดเล็กที่มีมูลค่าหลักทรัพย์ตามราคาตลาด (Market Capitalization) ไม่เกิน 80,000 ล้านบาท | อาจลงทุนในสัญญาซื้อขายล่วงหน้าเพื่อการเพิ่มประสิทธิภาพการบริหารการลงทุน (Efficient Portfolio Management) | มุ่งหวังให้ผลประกอบการเคลื่อนไหวสูงกว่าดัชนีชี้วัด (active management)",น.ส. นินัทธ์ วงศ์เสงี่ยม
K-FIXED-A,ลงทุนในตราสารหนี้ภาครัฐและภาคเอกชน และเงินฝากในประเทศ | อาจลงทุนในตราสารหนี้ที่มีอันดับความน่าเชื่อถือต่ำกว่าที่สามารถลงทุนได้ (non – investment grade) และตราสารหนี้ที่ไม่ได้รับการจัดอันดับความน่าเชื่อถือ (Unrated Securities) ได้ไม่เกิน 15% ของ NAV | ลงทุนในหน่วยลงทุนของกองทุนรวมอื่นซึ่งอยู่ภายใต้การบริหารจัดการได้ไม่เกิน 60% ของ NAV และกองทุนรวมอื่นนั้นมีการลงทุนในกองทุนรวมใดๆ ที่อยู่ภายใต้การบริหารจัดการของบริษัทจัดการเดียวกันต่อได้อีกไม่เกิน 1 ทอด | อาจลงทุนในสัญญาซื้อขายล่วงหน้าเพื่อการเพิ่มประสิทธิภาพการบริหารการลงทุน (Efficient Portfolio Management) | มุ่งหวังให้ผลประกอบการเคลื่อนไหวตามดัชนีชี้วัด และในบางโอกาสอาจสร้างผลตอบแทนสูงกว่าดัชนีชี้วัด,นาย ฐานันดร โชลิตกุล | นาย ภราดร เอี่ยวปรีดา
K-FIXED-Z,ลงทุนในตราสารหนี้ภาครัฐและภาคเอกชน และเงินฝากในประเทศ | อาจลงทุนในตราสารหนี้ที่มีอันดับความน่าเชื่อถือต่ำกว่าที่สามารถลงทุนได้ (non – investment grade) และตราสารหนี้ที่ไม่ได้รับการจัดอันดับความน่าเชื่อถือ (Unrated Securities) ได้ไม่เกิน 15% ของ NAV | ลงทุนในหน่วยลงทุนของกองทุนรวมอื่นซึ่งอยู่ภายใต้การบริหารจัดการได้ไม่เกิน 60% ของ NAV และกองทุนรวมอื่นนั้นมีการลงทุนในกองทุนรวมใดๆ ที่อยู่ภายใต้การบริหารจัดการของบริษัทจัดการเดียวกันต่อได้อีกไม่เกิน 1 ทอด | อาจลงทุนในสัญญาซื้อขายล่วงหน้าเพื่อการเพิ่มประสิทธิภาพการบริหารการลงทุน (Efficient Portfolio Management) | มุ่งหวังให้ผลประกอบการเคลื่อนไหวตามดัชนีชี้วัด และในบางโอกาสอาจสร้างผลตอบแทนสูงกว่าดัชนีชี้วัด,นาย ฐานันดร โชลิตกุล | นาย ภราดร เอี่ยวปรีดา
K-USARMF,"กองทุนนี้เปลี่ยนชื่อย่อกองทุนมาจาก KUSARMF เมื่อวันที่ 12 มีนาคม 2568 | กองทุนนี้เปลี่ยนกองทุนหลักเป็นกองทุน Brown Advisory US Sustainable Growth Fund, Dollar Class SI Acc เมื่อวันที่ 16 พ.ค. 66 | ลงทุนในกองทุน Brown Advisory US Sustainable Growth Fund, Dollar Class SI Acc (กองทุนหลัก) ที่มีนโยบายลงทุนในตราสารทุนของบริษัทสหรัฐอเมริกาที่มีปัจจัยพื้นฐานดีและมีรูปแบบธุรกิจที่สามารถเติบโตได้อย่างยั่งยืนในระยะยาวอย่างน้อย 80% ของทรัพย์สินสุทธิ ซึ่งจะลงทุนในหุ้นสามัญเป็นหลัก | ป้องกันความเสี่ยงจากอัตราแลกเปลี่ยนตามดุลยพินิจของผู้จัดการกองทุน รวมถึงอาจลงทุนในสัญญาซื้อขายล่วงหน้าเพื่อเพิ่มประสิทธิภาพการบริหารการลงทุน (Efficient Portfolio Management) | บริษัทที่บริหารจัดการกองทุนหลัก คือ Brown Advisory (Ireland) Limited | กองทุนมุ่งหวังให้ผลประกอบการเคลื่อนไหวตามกองทุนหลัก โดยกองทุนหลักมุ่งหวังให้ผลประกอบการเคลื่อนไหวสูงกว่าดัชนีชี้วัด (active management)",น.ส. วีรยา จุลมนต์
K-GINCOME-A(A),"ลงทุนในกองทุน JPMorgan Investment Funds – Global Income Fund, Class I (mth) - USD (hedged) (กองทุนหลัก) ที่มีนโยบายลงทุนในตราสารหนี้ ตราสารทุน และหน่วยทรัสต์ของทรัสต์เพื่อการลงทุนในอสังหาริมทรัพย์ (REITs) ทั่วโลก โดยเน้นลงทุนในตราสารที่มีการจ่ายผลตอบแทนสูง ทั้งในรูปดอกเบี้ยหรือเงินปันผล | ป้องกันความเสี่ยงจากอัตราแลกเปลี่ยนไม่น้อยกว่า 75% ของมูลค่าเงินลงทุนต่างประเทศ | บริษัทที่บริหารจัดการกองทุนหลัก คือ JPMorgan Asset Management (Europe) S.à r.l. | กองทุนมุ่งหวังให้ผลประกอบการเคลื่อนไหวตามกองทุนหลัก โดยกองทุนหลักมุ่งหวังให้ผลประกอบการเคลื่อนไหวสูงกว่าดัชนีชี้วัด (active management)",น.ส. ชุณหวรรณ ขัตตินานนท์
K-GINCOME-A(R),"ลงทุนในกองทุน JPMorgan Investment Funds – Global Income Fund, Class I (mth) - USD (hedged) (กองทุนหลัก) ที่มีนโยบายลงทุนในตราสารหนี้ ตราสารทุน และหน่วยทรัสต์ของทรัสต์เพื่อการลงทุนในอสังหาริมทรัพย์ (REITs) ทั่วโลก โดยเน้นลงทุนในตราสารที่มีการจ่ายผลตอบแทนสูง ทั้งในรูปดอกเบี้ยหรือเงินปันผล | ป้องกันความเสี่ยงจากอัตราแลกเปลี่ยนไม่น้อยกว่า 75% ของมูลค่าเงินลงทุนต่างประเทศ | บริษัทที่บริหารจัดการกองทุนหลัก คือ JPMorgan Asset Management (Europe) S.à r.l. | กองทุนมุ่งหวังให้ผลประกอบการเคลื่อนไหวตามกองทุนหลัก โดยกองทุนหลักมุ่งหวังให้ผลประกอบการเคลื่อนไหวสูงกว่าดัชนีชี้วัด (active management)",น.ส. ชุณหวรรณ ขัตตินานนท์
